{
  "event_id": "00000000-0000-4000-8000-000000000018",
  "tenant_id": "00000000-0000-4000-8000-000000000020",
  "aggregate_type": "shipment",
  "aggregate_id": "00000000-0000-4000-8000-000000000015",
  "aggregate_version": "6",
  "event_type": "inventory.posted",
  "schema_version": 1,
  "occurred_at": "2026-10-08T08:00:00Z",
  "correlation_id": "00000000-0000-4000-8000-000000000019",
  "causation_id": null,
  "payload": {
    "posting_id": "00000000-0000-4000-8000-000000000016",
    "document_id": "00000000-0000-4000-8000-000000000015",
    "entity_id": "00000000-0000-4000-8000-000000000002",
    "changes": [
      {
        "balance_id": "00000000-0000-4000-8000-000000000021",
        "sku_id": "00000000-0000-4000-8000-000000000006",
        "qty_delta": "-8"
      }
    ]
  }
}